pmid,title,abstract,year,month,day
35056453,Immune Responses to SARS-CoV-2 Infection and Vaccination in Dialysis Patients and Kidney Transplant Recipients.,Dialysis patients and kidney transplant (KTX) recipients suffer from an impaired immune system and show a decreased response to the severe acute respiratory syndrome coronavirus type 2 (SARS-CoV-2) vaccination. We performed a retrospective analysis of 1505 serological SARS-CoV-2 measurements obtained from 887 dialysis patients and 86 KTX recipients. The results were separated by patient subgroups (dialysis/KTX) as well as SARS-CoV-2 status. The latter criterion included SARS-CoV-2-naïve patients,2022,1,28
35056015,Six-Month Follow-Up after Vaccination with BNT162b2: SARS-CoV-2 Antigen-Specific Cellular and Humoral Immune Responses in Hemodialysis Patients and Kidney Transplant Recipients.,"Hemodialysis patients (HDP) and kidney transplant recipients (KTR) have a high risk of infection with SARS-CoV-2 with poor clinical outcomes. Because of this, vaccination of these groups of patients against SARS-CoV-2 is particularly important. However, immune responses may be impaired in immunosuppressed and chronically ill patients. Here, our aim was to compare the efficacy of an mRNA-based vaccine in HDP, KTR, and healthy subjects. In this prospective observational cohort study, the humoral a",2022,1,28
35051990,Neutralizing antibodies against the SARS-CoV-2 Delta and Omicron variants following heterologous CoronaVac plus BNT162b2 booster vaccination.,"The recent emergence of the SARS-CoV-2 Omicron variant is raising concerns because of its increased transmissibility and by its numerous spike mutations with potential to evade neutralizing antibodies elicited by COVID-19 vaccines. Here, we evaluated the effects of a heterologous BNT162b2 mRNA vaccine booster on the humoral immunity of participants that had received a two-dose regimen of CoronaVac, an inactivated vaccine used globally. We found that heterologous CoronaVac prime followed by BNT16",2022,1,20
35051137,"Use of the Janssen (Johnson &amp; Johnson) COVID-19 Vaccine: Updated Interim Recommendations from the Advisory Committee on Immunization Practices - United States, December 2021.","On February 27, 2021, the Food and Drug Administration (FDA) issued an Emergency Use Authorization (EUA) for the adenovirus-vectored COVID-19 vaccine (Janssen Biotech, Inc., a Janssen Pharmaceutical company, Johnson &amp; Johnson), and on February 28, 2021, the Advisory Committee on Immunization Practices (ACIP) issued an interim recommendation for its use as a single-dose primary vaccination in persons aged =18 years (1,2). On April 13, 2021, CDC and FDA recommended a pause in the use of Jansse",2022,1,28
35046572,mRNA booster immunization elicits potent neutralizing serum activity against the SARS-CoV-2 Omicron variant.,"The Omicron variant of SARS-CoV-2 is causing a rapid increase in infections across the globe. This new variant of concern carries an unusually high number of mutations in key epitopes of neutralizing antibodies on the viral spike glycoprotein, suggesting potential immune evasion. Here we assessed serum neutralizing capacity in longitudinal cohorts of vaccinated and convalescent individuals, as well as monoclonal antibody activity against Omicron using pseudovirus neutralization assays. We report",2022,1,22
35045566,"Effectiveness of COVID-19 booster vaccines against covid-19 related symptoms, hospitalisation and death in England.","Booster vaccination with mRNA vaccines have been offered to adults in England starting on 14 September 2021. We used a test-negative case-control design to estimate the relative effectiveness of a booster dose of BNT162b2 (Pfizer-BioNTech) compared to only a 2-dose primary course (at least 175 days after the second dose) as well as compared to unvaccinated individuals from 13 September 2021 to 5 December 2021, when Delta variant was dominant in circulation. Outcomes were symptomatic COVID-19 and",2022,1,19
35043108,A single dose ChAdOx1 nCoV-19 vaccine elicits high antibody responses in individuals with prior SARS-CoV-2 infection comparable to that of double dose vaccinated SARS-CoV-2 infection naïve individuals.,"Background A single dose COVID-19 vaccines, mostly mRNA-based vaccines, are shown to induce robust antibody responses in individuals who were previously infected with SARS-CoV-2, suggesting the sufficiency of a single dose to those individuals. However, these important data are limited to developed nations and lacking in resource-limited countries, like Ethiopia. Methods We compared receptor-binding domain (RBD)-specific IgG antibodies in 40 SARS-CoV-2 naïve participants and 25 participants prev",2022,1,25
35041700,Development and utilization of a surrogate SARS-CoV-2 viral neutralization assay to assess mRNA vaccine responses.,"Tests for SARS-CoV-2 immunity are needed to help assess responses to vaccination, which can be heterogeneous and may wane over time. The plaque reduction neutralization test (PRNT) is considered the gold standard for measuring serum neutralizing antibodies but requires high level biosafety, live viral cultures and days to complete. We hypothesized that competitive enzyme linked immunoassays (ELISAs) based on SARS-CoV-2 spike protein's receptor binding domain (RBD) attachment to its host receptor",2022,1,24
35027397,Additional heterologous versus homologous booster vaccination in immunosuppressed patients without SARS-CoV-2 antibody seroconversion after primary mRNA vaccination: a randomised controlled trial.,"SARS-CoV-2-induced COVID-19 has led to exponentially rising mortality, particularly in immunosuppressed patients, who inadequately respond to conventional COVID-19 vaccination. In this blinded randomised clinical trial, we compare the efficacy and safety of an additional booster vaccination with a vector versus mRNA vaccine in non-seroconverted patients. We assigned 60 patients under rituximab treatment, who did not seroconvert after their primary mRNA vaccination with either BNT162b2 (Pfizer-Bi",2022,1,14
35018390,Predicting COVID-19 severity using major risk factors and received vaccines.,"Vaccines are highly effective in preventing severe disease and death from COVID-19, and new medications that can reduce severity of disease have been approved. However, many countries are facing limited supply of vaccine doses and medications. A model estimating the probabilities for hospitalization and mortality according to individual risk factors and vaccine doses received could help prioritize vaccination and yet scarce medications to maximize lives saved and reduce the burden on hospitaliza",2022,1,15
35011801,Waning Humoral Response 3 to 6 Months after Vaccination with the SARS-COV-2 BNT162b2 mRNA Vaccine in Dialysis Patients.,"The short-term reported antibody response to SARS-COV-2 vaccination in dialysis patients is high, with a seroconversion response rate up to 97%. Data on the long-term durability of this response are scarce. Our objective was to characterize the long-term anti-spike antibody level in dialysis patients. In an observational study, we measured SARS-COV-2 anti-spike antibody levels in dialysis patients who completed 2 doses of the BNT162b2 mRNA SAR S-COV-2 vaccine at 1, 3 and 6 months after the secon",2022,1,14
34995482,mRNA-based COVID-19 vaccine boosters induce neutralizing immunity against SARS-CoV-2 Omicron variant.,"Recent surveillance has revealed the emergence of the SARS-CoV-2 Omicron variant (BA.1/B.1.1.529) harboring up to 36 mutations in spike protein, the target of neutralizing antibodies. Given its potential to escape vaccine-induced humoral immunity, we measured the neutralization potency of sera from 88 mRNA-1273, 111 BNT162b, and 40 Ad26.COV2.S vaccine recipients against wild-type, Delta, and Omicron SARS-CoV-2 pseudoviruses. We included individuals that received their primary series recently (&l",2022,2,16
34990440,"Risk Factors for Severe COVID-19 Outcomes Among Persons Aged =18 Years Who Completed a Primary COVID-19 Vaccination Series - 465 Health Care Facilities, United States, December 2020-October 2021.","Vaccination against SARS-CoV-2, the virus that causes COVID-19, is highly effective at preventing COVID-19-associated hospitalization and death; however, some vaccinated persons might develop COVID-19 with severe outcomes<sup>?/sup> (1,2). Using data from 465 facilities in a large U.S. health care database, this study assessed the frequency of and risk factors for developing a severe COVID-19 outcome after completing a primary COVID-19 vaccination series (primary vaccination), defined as receip",2022,1,20
34987509,An Intranasal OMV-Based Vaccine Induces High Mucosal and Systemic Protecting Immunity Against a SARS-CoV-2 Infection.,"The development of more effective, accessible, and easy to administer COVID-19 vaccines next to the currently marketed mRNA, viral vector, and whole inactivated virus vaccines is essential to curtailing the SARS-CoV-2 pandemic. A major concern is reduced vaccine-induced immune protection to emerging variants, and therefore booster vaccinations to broaden and strengthen the immune response might be required. Currently, all registered COVID-19 vaccines and the majority of COVID-19 vaccines in deve",2022,1,19
34981057,"SARS-CoV-2 Omicron neutralization by therapeutic antibodies, convalescent sera, and post-mRNA vaccine booster.","The rapid spread of the highly contagious Omicron variant of SARS-CoV-2 along with its high number of mutations in the spike gene has raised alarm about the effectiveness of current medical countermeasures. To address this concern, we measured neutralizing antibodies against Omicron in three important settings: (1) post-vaccination sera after two and three immunizations with the Pfizer/BNT162b2 vaccine, (2) convalescent sera from unvaccinated individuals infected by different variants, and (3) c",2022,1,7
34960224,Evaluation of Antibody Response to Heterologous Prime-Boost Vaccination with ChAdOx1 nCoV-19 and BNT162b2: An Observational Study.,"In several countries, thrombotic events after vaccination with ChAdOx1 nCoV-19 have led to heterologous messenger RNA (mRNA) boosting. We tested the antibody response to SARS-CoV-2 spike protein four weeks after heterologous priming with the ChAdOx1 (ChAd) vector vaccine followed by boosting with BNT162b2(ChAd/BNT), comparing data of homologous regimen (BNT/BNT, ChAd/ChAd) subjects positive for SARS-CoV-2 after the first dose of BNT162b2 (BNT1dose/CoV2) and convalescent COVID-19. healthy subject",2021,12,31
34960189,Antibody Response of BNT162b2 and CoronaVac Platforms in Recovered Individuals Previously Infected by COVID-19 against SARS-CoV-2 Wild Type and Delta Variant.,"Vaccinating recovered patients previously infected by COVID-19 with mRNA vaccines to boost their immune response against wild-type viruses (WT), we aimed to investigate whether vaccine platform and time of vaccination affect immunogenicity against the SARS-CoV-2 WT and Delta variant (DV). Convalescent patients infected by COVID-19 were recruited and received one booster dose of the BNT162b2 (PC-B) or CoronaVac (PC-C) vaccines, while SARS-CoV-2 naïve subjects received two doses of the BNT162b2 (C",2021,12,31
34960158,Humoral Immune Response to SARS-CoV-2 Vaccination after a Booster Vaccine Dose in Two Kidney Transplant Recipients with Fabry Disease and Variable Secondary Immunosuppressive Regimens.,"The urgent need to fight the COVID-19 pandemic has accelerated the development of vaccines against SARS-CoV-2 and approval processes. Initial analysis of two-dose regimens with mRNA vaccines reported up to 95% efficacy against the original strain of the SARS-CoV-2 virus. Challenges arose with the appearance of new strains of the virus, and reports that solid organ transplant recipients may have reduced vaccination success rates after a two-dose mRNA vaccination regimen encouraged health authorit",2021,12,31
34960133,"A Systematic Review on COVID-19 Vaccine Strategies, Their Effectiveness, and Issues.","COVID-19 vaccines are indispensable, with the number of cases and mortality still rising, and currently no medicines are routinely available for reducing morbidity and mortality, apart from dexamethasone, although others are being trialed and launched. To date, only a limited number of vaccines have been given emergency use authorization by the US Food and Drug Administration and the European Medicines Agency. There is a need to systematically review the existing vaccine candidates and investiga",2021,12,31
34960122,Immunogenicity and Safety of an Intradermal BNT162b2 mRNA Vaccine Booster after Two Doses of Inactivated SARS-CoV-2 Vaccine in Healthy Population.,"Effective vaccine coverage is urgently needed to tackle the COVID-19 pandemic. Inactivated vaccines have been introduced in many countries for emergency usage, but have only provided limited protection. Heterologous vaccination is a promising strategy to maximise vaccine immunogenicity. Here, we conducted a phase I, randomised control trial to observe the safety and immunogenicity after an intradermal boost, using a fractional dosage (1:5) of BNT162b2 mRNA vaccine in healthy participants in Song",2021,12,31
34958917,Outbreak of SARS-CoV-2 B.1.617.2 (delta) variant in a nursing home 28 weeks after two doses of mRNA anti-COVID-19 vaccines: evidence of a waning immunity.,"To describe a severe acute respiratory syndrome coronavirus 2 (SARS-CoV-2) B.1.617.2 (Delta) variant outbreak among residents (n??9) and health workers (n??9) of a small nursing home in northeastern Italy, with full vaccination coverage of 91% and 82%, respectively. Evaluation of the anti-Spike IgG titres 28 weeks after the mRNA vaccine booster dose against SARS-CoV-2 infection and severe coronavirus disease 2019 (COVID-19). Sera were collected within 48 hours from the index case; anti-Spike",2022,1,22
34953607,"Cohort study of Covid-19 vaccine effectiveness among healthcare workers in Finland, December 2020 - October 2021.","Recently, Covid-19 vaccine effectiveness has decreased especially against mild disease due to emergence of the Delta variant and waning protection. In this register-based study among healthcare workers in Finland, the vaccine effectiveness of two-dose mRNA vaccine series against SARS-CoV-2 infection decreased from 82% (95% CI 79-85%) 14-90 days after vaccination to 53% (43-62%) after 6 months. Similar trend was observed for other series. Waning was not observed against Covid-19 hospitalization. ",2022,1,26
34946275,Dynamics of Antibody Response to BNT162b2 mRNA COVID-19 Vaccine: A 7-Month Follow-Up Study.,"Background and Objectives: Comprehension regarding immunity to severe acute respiratory syndrome coronavirus 2 (SARS-CoV-2) is limited, and the durability of immune responses after vaccination is currently unknown. Several studies have reported on the antibody response in fully vaccinated individuals with a limited follow-up of the participants, i.e., below 7 months. Materials and Methods: The antibody response to complete vaccination with the BNT162b2 mRNA COVID-19 vaccine was ass",2021,12,27
34938959,Sustained but Declining Humoral Immunity Against SARS-CoV-2 at 9 Months Postvaccination With BNT162b2: A Prospective Evaluation in 309 Healthy Individuals.,The sustainability of coronavirus 19 (COVID-19) vaccine-induced immunity against severe acute respiratory syndrome coronavirus 2 (SARS-CoV-2) is critical to be determined to inform public health decisions on vaccination programs and prevention measures against COVID-19. The aim of the present study was to prospectively evaluate the kinetics of neutralizing antibodies (NAbs) and anti-S-receptor binding domain (RBD IgGs) against SARS-CoV-2 after full vaccination with the BNT162b2 mRNA vaccine for ,2021,12,24
34927258,Omicron: Call for updated vaccines.,"The Omicron SARS-CoV-2 variant was potentially generated from a chronically infected COVID-19 patient vaccinated with an messenger RNA (mRNA)- or non-mRNA-based vaccine, offering the opportunity for the virus to evolve and mutate to evade the body's immune response. To understand the significance of this SARS-CoV-2 variant and what it means for the global response to the pandemic, vaccinologists should systematically evaluate the role of mRNA- and non-mRNA-based vaccines in the generation of nov",2022,2,17
34911170,Neutralizing antibody titers six months after Comirnaty vaccination: kinetics and comparison with SARS-CoV-2 immunoassays.,"mRNA vaccines, including Comirnaty (BNT162b2 mRNA, BioNTech-Pfizer), elicit high IgG and neutralizing antibody (NAb) responses after the second dose, but the progressive decrease in serum antibodies against SARS-CoV-2 following vaccination have raised questions concerning long-term immunity, decreased antibody levels being associated with breakthrough infections after vaccination, prompting the consideration of booster doses. A total number of 189 Padua University-Hospital healthcare workers (HC",2022,2,14
34909777,Loss of Neutralizing Antibody Response to mRNA Vaccination against SARS-CoV-2 Variants: Differing Kinetics and Strong Boosting by Breakthrough Infection.,"The waning efficacy of SARS-CoV-2 vaccines combined with the continued emergence of variants resistant to vaccine-induced immunity has reignited debate over the need for booster vaccines. To address this, we examined the neutralizing antibody (nAb) response against four major SARS-CoV-2 variants-D614G, Alpha (B.1.1.7), Beta (B.1.351), and Delta (B.1.617.2)-in health care workers (HCWs) at pre-vaccination, post-first and post-second mRNA vaccine dose, and six months post-second mRNA vaccine dose.",2021,12,21
34906769,"Efficacy of mRNA, adenoviral vector, and perfusion protein COVID-19 vaccines.","Coronavirus disease 2019 (COVID-19) has a devastating impact on global populations triggered by a highly infectious viral sickness, produced by the severe acute respiratory syndrome coronavirus 2 (SARS-CoV-2). The third major cause of mortality in the United States, following heart disease and cancer in 2020, was undoubtedly COVID-19. The centers for disease control and prevention (CDC) and the world health organization (WHO) separately developed a categorization system for differentiating new s",2022,1,24
34906291,"Effectiveness of mRNA BNT162b2 Vaccine 6 Months after Vaccination among Patients in Large Health Maintenance Organization, Israel.","Israel experienced a new wave of coronavirus disease during June 2021, six months after implementing a national vaccination campaign. We conducted 3 discrete analyses using data from a large health maintenance organization in Israel to determine whether IgG levels of fully vaccinated persons decrease over time, describe the relationship between IgG titer and subsequent PCR-confirmed infection, and compare PCR-confirmed infection rates by period of vaccination. Mean IgG levels steadily decreased ",2022,1,27
34901098,Rapid Progression of Angioimmunoblastic T Cell Lymphoma Following BNT162b2 mRNA Vaccine Booster Shot: A Case Report.,"Since nucleoside-modified mRNA vaccines strongly activate T follicular helper cells, it is important to explore the possible impact of approved SARS-CoV-2 mRNA vaccines on neoplasms affecting this cell type. Herein, we report and discuss unexpected rapid progression of lymphomatous lesions after administration of a BNT162b2 mRNA vaccine booster in a man recently diagnosed with AITL.",2021,12,15
34899701,Robust Antibody Levels in Both Diabetic and Non-Diabetic Individuals After BNT162b2 mRNA COVID-19 Vaccination.,"The emergence of effective vaccines for COVID-19 has been welcomed by the world with great optimism. Given their increased susceptibility to COVID-19, the question arises whether individuals with type-2 diabetes mellitus (T2DM) and other metabolic conditions can respond effectively to the mRNA-based vaccine. We aimed to evaluate the levels of anti-SARS-CoV-2 IgG and neutralizing antibodies in people with T2DM and/or other metabolic risk factors (hypertension and obesity) compared to those withou",2021,12,27
34896516,SARS-CoV-2 antibody and T cell responses one year after COVID-19 and the booster effect of vaccination: A prospective cohort study.,"First, to describe SARS-CoV-2 T cell and antibody responses in a prospective cohort of healthcare workers that suffered from mild to moderate COVID-19 approximately one year ago. Second, to assess COVID-19 vaccine-induced immune responses in these prior-infected individuals. SARS-CoV-2-specific T cell and anti-SARS-CoV-2-Spike-RBD immunoglobulin G (IgG) responses in blood were determined before COVID-19 vaccination with mRNA-1273, BNT162b2, Ad26.CoV2-S or ChAdOx1-S, two weeks after first vaccina",2022,2,18
34882654,"Comparative Effectiveness and Antibody Responses to Moderna and Pfizer-BioNTech COVID-19 Vaccines among Hospitalized Veterans - Five Veterans Affairs Medical Centers, United States, February 1-September 30, 2021.","The mRNA COVID-19 vaccines (Moderna and Pfizer-BioNTech) provide strong protection against severe COVID-19, including hospitalization, for at least several months after receipt of the second dose (1,2). However, studies examining immune responses and differences in protection against COVID-19-associated hospitalization in real-world settings, including by vaccine product, are limited. To understand how vaccine effectiveness (VE) might change with time, CDC and collaborators assessed the comparat",2021,12,10
34880128,Humoral protection to SARS-CoV2 declines faster in patients on TNF alpha blocking therapies.,"The persistence of the SARS-CoV2 pandemic, partly due to the appearance of highly infectious variants, has made booster vaccinations necessary for vulnerable groups. Questions remain as to which cohorts require SARS-CoV2 boosters. However, there is a critical lack of data on the dynamics of vaccine responses in patients with chronic inflammatory diseases (CID) undergoing immunosuppressive/disease modifying anti-rheumatic (DMARD) treatment. Here, we present the first data regarding the decline of",2021,12,13
34877586,Adverse reactions and safety profile of the mRNA COVID-19 vaccines among Asian military personnel.,"The use of novel mRNA platforms for COVID-19 vaccines raised concern about vaccine safety, especially in Asian populations that made up less than 10% of study populations in the pivotal vaccine trials used for emergency use authorisation. Vaccine safety issues also remain a concern in assessing the clinical risks and benefits of vaccine boosters, particularly in specific age groups or segments of the population. This study describes a vaccination exercise involving Asian military personnel, and ",2021,12,9
34874183,Robust immune responses are observed after one dose of BNT162b2 mRNA vaccine dose in SARS-CoV-2-experienced individuals.,"The use of coronavirus disease 2019 (COVID-19) vaccines will play the major role in helping to end the pandemic that has killed millions worldwide. COVID-19 vaccines have resulted in robust humoral responses and protective efficacy in human trials, but efficacy trials excluded individuals with a prior diagnosis of COVID-19. As a result, little is known about how immune responses induced by mRNA vaccines differ in individuals who recovered from COVID-19. Here, we evaluated longitudinal immune res",2022,2,14
34872162,Efficacy and safety of heterologous booster vaccination with Ad26.COV2.S after BNT162b2 mRNA COVID-19 vaccine in haemato-oncological patients with no antibody response.,"Patients with haemato-oncological malignancies are one of the high-risk groups for a severe course in case of COVID-19 infections. Furthermore, vaccination results in significantly lower response rates in haematological malignancies and lower antibody levels in patients with solid cancer. We investigated efficacy and safety of a heterologous booster vaccination with Ad26.COV2.S DNA vector vaccine in haemato-oncological patients without antibody response after double-dose BNT162b2 messenger (m-)R",2022,2,1
34865109,No further delays in offering booster doses in countries experiencing a major resurgence of COVID-19.,no abstract,2022,1,5
34862313,"Immunogenicity, safety and reactogenicity of a heterogeneous booster following the CoronaVac inactivated SARS-CoV-2 vaccine in patients with SLE: a case series.","Since the COVID-19 pandemic, CoronaVac, an inactivated SARS-CoV-2 vaccine, has been widely deployed in several countries for emergency use. However, the immunogenicity of the inactivated vaccine was relatively lower when compared to other vaccine types and was even more attenuated in autoimmune patients with rheumatic disease. A third-dose SARS-CoV-2 vaccination in immunosuppressed population is recommended in order to improve immune response. However, the data were limited to those initially re",2021,12,9
34845421,Covid-19 vaccine and its consequences in pregnancy: Brief review.,"Pregnancy is linked to a higher incidence of severe Covid-19. It's critical to find safe vaccinations that elicit protective pregnant and fetal immune responses. This review summarises the rate of COVID-19 infection, maternal antibodies responsiveness, placenta antibody transmission, and adverse events after COVID-19 vaccination in pregnancy studied in epidemiological studies evaluating mRNA vaccines. Potential COVID-19 infection in pregnant women can be prevented using mRNA-based vaccinations. ",2021,12,1
