pmid,title,abstract,year,month,day
34835217,Willingness to Receive the Booster COVID-19 Vaccine Dose in Poland.,"COVID-19 vaccinations are essential to mitigate the pandemic and prevent severe SARS-CoV-2 infections. However, the serum antibody levels in vaccinated individuals gradually decrease over time, while SARS-CoV-2 is undergoing an evolution toward more transmissible variants, such as B.1.617.2, ultimately increasing the risk of breakthrough infections and further virus spread. This cross-sectional online study of adult Poles (n = 2427) was conducted in September 2021 (before a general recomm",2021,11,29
34828612,"COVID-19 Delta Variant: Perceptions, Worries, and Vaccine-Booster Acceptability among Healthcare Workers.","Background: As the COVID-19 Delta variant has spread across the globe, healthcare workers' (HCWs) knowledge, worries, and vaccine booster acceptance should be assessed. Methods: Online questionnaires aimed at HCWs in Saudi Arabia were distributed between 9 and 12 August 2021, aiming to evaluate HCWs' perceptions and worries about the Delta variant as well as their feelings about receiving a booster-vaccine. Results: A total of 1279 HCWs participated, with 51.1% being physici",2021,11,30
34824035,Inactivated SARS-CoV-2 vaccines elicit immunogenicity and T-cell responses in people living with HIV.,"To date, the effects of SARS-CoV-2 vaccines on people living with HIV (PLWH) were mainly focused on messenger RNA (mRNA) and adenovirus vector-based vaccines, and little is known about the effects of inactivated virus-based vaccine. This study was designed to determine the effects of inactivated SARS-CoV-2 vaccines on PLWH. Twenty-four HIV-positive individuals and 24 healthy donors (HD) were respectively recruited from Malipo Country People's Hospital and community in Kunming city. Enumeration o",2021,12,27
34820240,A Case of Idiopathic Thrombocytopenic Purpura After Booster Dose of BNT162b2 (Pfizer-Biontech) COVID-19 Vaccine.,"Vaccination is now considered the best measure in minimizing the morbidity and mortality from the Covid-19 pandemic. Almost all the vaccines are considered safe except for minor and occasional side effects. Some of the commonly reported complications from the COVID-19 vaccines are vaccine-induced thrombotic thrombocytopenia?VITT)/thrombosis with thrombocytopenia syndrome/vaccine-induced pro-thrombotic immune thrombocytopenia syndrome. In this case report, we present a case of a 75-year-old fema",2021,11,26
34815117,Variant SARS-CoV-2 mRNA vaccines confer broad neutralization as primary or booster series in mice.,"Severe acute respiratory syndrome coronavirus 2 (SARS-CoV-2) is the causative agent of a global pandemic. Safe and effective COVID-19 vaccines are now available, including mRNA-1273, which has shown 94% efficacy in prevention of symptomatic COVID-19 disease. However, the emergence of SARS-CoV-2 variants has led to concerns of viral escape from vaccine-induced immunity. Several variants have shown decreased susceptibility to neutralization by vaccine-induced immunity, most notably B.1.351 (Beta),",2021,12,22
34802792,BNT162b2 mRNA COVID-19 vaccine Reactogenicity: The key role of immunity.,"We examined the impact of pre-existing SARS-CoV-2-specific cellular immunity on BNT162b2 mRNA COVID-19 vaccine reactogenicity. Of 96 healthcare workers (HCWs), 76% reported any vaccine reaction (first dose: 70%, second dose: 67%), none of which was severe. Following first dose, systemic reactions were significantly more frequent among HCWs with past infection than in infection-naïve individuals, and among HCWs with pre-existing cellular immunity than in those without it. The rate of systemic rea",2021,12,22
34797219,Humoral Immunogenicity of mRNA COVID-19 Vaccines Among Patients With Inflammatory Bowel Disease and Healthy Controls.,Patients with inflammatory bowel disease (IBD) on immune-modifying therapies may have a lower vaccine response to certain vaccines. The aim of our study was to evaluate humoral immunogenicity of mRNA coronavirus disease 2019 (COVID-19) vaccines among patients with IBD and healthy controls (HCs). We performed a prospective study to evaluate humoral immunogenicity among patients with IBD and HCs after completion of mRNA COVID-19 vaccines. One hundred twenty-two patients with IBD and 60 HCs were en,2022,1,13
34788858,Safety and immediate humoral response of COVID-19 vaccines in chronic kidney disease patients: the SENCOVAC study.,"Chronic kidney disease (CKD) patients are at high-risk for severe Covid-19. The multicentric, observational and prospective SENCOVAC study aims to describe the humoral response and safety of SARS-CoV-2 vaccines in CKD patients. Safety and immediate humoral response results are reported here. Four cohorts of patients were included: kidney transplant (KT) recipients, haemodialysis (HD), peritoneal dialysis (PD) and non-dialysis CKD patients from 50 Spanish centres. Adverse events after vaccine dos",2022,1,21
34788497,mRNA vaccines against COVID-19: a showcase for the importance of microbial biotechnology.,Pfizer-BioNTech and Moderna developed in record time mRNA vaccines against COVID-19 of high efficacy. The modest protection achieved with a similarly designed mRNA from CureVac underlines the importance of biotechnological details in formulation such as replacement of uridine by pseudouridine in the mRNA encoding the SARS-CoV-2 spike protein or the lipid composition of the nanoparticle coating the mRNA. Phase 3 vaccine trials and vaccine studies in special subject groups as well observational st,2022,1,10
34781162,Impaired immunogenicity to COVID-19 vaccines in autoimmune systemic diseases. High prevalence of non-response in different patients' subgroups.,"Autoimmune systemic diseases (ASD) may show impaired immunogenicity to COVID-19 vaccines. Our prospective observational multicenter study aimed to evaluate the seroconversion after the vaccination cycle and at 6-12-month follow-up, as well the safety and efficacy of vaccines in preventing COVID-19. The study included 478 unselected ASD patients (mean age 59 ±?5 years), namely 101 rheumatoid arthritis (RA), 38 systemic lupus erythematosus (SLE), 265 systemic sclerosis (SSc), 61 cryoglobulinemic ",2021,12,28
34775740,Booster or additional vaccination doses in patients vaccinated against COVID-19.,"Several health organizations, mainly in Western countries, have recently authorized the use of a booster dose of the COVID-19 vaccine for patients previously vaccinated with mRNA vaccines, with criteria that do not always coincide. The COVID Scientific Committee of the Illustrious College of Physicians of Madrid (ICOMEM) has received and asked several questions about this situation, to which the group has tried to give answers, after deliberation and consensus. The efficacy of the vaccines admin",2021,11,15
34763949,COVID-19 vaccine - Long term immune decline and breakthrough infections.,"Since the introduction of BNT162b2 mRNA COVID-19 vaccine by Pfizer in late 2020, efficacy and immunogenicity waning of COVID-19 vaccines was reported, and decision making regarding a booster remains a top priority worldwide, a decision that should be made based on breakthrough infection rate and antibody titer decline overtime. We conducted a 5-month longitudinal prospective study involving vaccinated healthcare personnel, who were tested monthly for antibody titer, and sampled biweekly and on c",2021,11,26
34759001,Longitudinal SARS-CoV-2 mRNA Vaccine-Induced Humoral Immune Responses in Patients with Cancer.,"Longitudinal studies of severe acute respiratory syndrome coronavirus 2 (SARS-CoV-2) vaccine-induced immune responses in patients with cancer are needed to optimize clinical care. In a prospective cohort study of 366 (291 vaccinated) patients, we measured antibody levels [anti-spike (IgG-(S-RBD) and anti-nucleocapsid immunoglobulin] at three time points. Antibody level trajectories and frequency of breakthrough infections were evaluated by tumor type and timing of treatment relative to vaccinati",2022,1,7
34756184,Effectiveness of a third dose of the BNT162b2 mRNA COVID-19 vaccine for preventing severe outcomes in Israel: an observational study.,"Many countries are experiencing a resurgence of COVID-19, driven predominantly by the delta (B.1.617.2) variant of SARS-CoV-2. In response, these countries are considering the administration of a third dose of mRNA COVID-19 vaccine as a booster dose to address potential waning immunity over time and reduced effectiveness against the delta variant. We aimed to use the data repositories of Israel's largest health-care organisation to evaluate the effectiveness of a third dose of the BNT162b2 mRNA ",2021,12,14
34747190,The mRNA COVID-19 vaccine in patients with cancer receiving checkpoint inhibitor therapy: what we know and what we don't.,no abstract,2022,1,12
34746900,Lymphadenopathy after the third Covid-19 vaccine.,"Axillary lymphadenopathy ipsilateral to the vaccination site has been clinically and radiologically reported after administration of COVID-19 vaccines. This can be an important diagnostic dilemma, particularly in cancer patients who are being staged or re-staged, as this benign entity may mimic metastasis, cause unnecessary biopsies and changes in therapy. Here we present a breast cancer patient and a patient with squamous cell carcinoma of the head and neck, who had already received the first t",2021,12,24
34744992,Case Report: Multiple Sclerosis Relapses After Vaccination Against SARS-CoV2: A Series of Clinical Cases.,"Objective: To describe a temporal association between COVID-19 vaccine administration and multiple sclerosis (MS) relapses. Methods: This case series study was collected in four MS Centres in Central Italy, using data from 16 MS patients who received COVID-19 vaccination and presented both clinically and radiologically confirmed relapses between March and June 2021. We collected patients' relevant medical history, including demographics, MS clinical course, disease-modifying treatm",2021,11,10
34741188,Evaluation of antibody response to BNT162b2 mRNA COVID-19 vaccine in patients affected by immune-mediated inflammatory diseases up to 5 months after vaccination.,"SARS-CoV-2 vaccination with mRNA product BNT162b2 elicited high immunogenicity in healthy subjects in trials. This study aims to better understand the factors that influence the humoral immune response to vaccination against SARS-CoV-2 in patients with immune-mediated inflammatory diseases (IMIDs). We enrolled patients and healthy healthcare workers control group (HCW) that underwent mRNA BNT162b2 vaccination and measured the serum IgG anti-S-RBD response at booster dose (T1), one month after bo",2021,11,8
34740463,Acute Myocarditis after COVID-19 vaccination: A case report.,"The etiology of myocarditis often remains undetermined. A large variety of infectious agents, systemic diseases, drugs, and toxins can cause the disease. We report the case of a 19-year-old man who developed myocarditis three days after Pfizer-BioNTech COVID-19 booster vaccination. A 19-year-old man, presenting with troponin-positive acute chest pain, was referred to our department. He had received the Pfizer-BioNTech COVID-19 vaccine three days prior to his admission. The diagnosis of acute myo",2021,11,24
34735426,"Effectiveness of 2-Dose Vaccination with mRNA COVID-19 Vaccines Against COVID-19-Associated Hospitalizations Among Immunocompromised Adults - Nine States, January-September 2021.","Immunocompromised persons, defined as those with suppressed humoral or cellular immunity resulting from health conditions or medications, account for approximately 3% of the U.S. adult population (1). Immunocompromised adults are at increased risk for severe COVID-19 outcomes (2) and might not acquire the same level of protection from COVID-19 mRNA vaccines as do immunocompetent adults (3,4). To evaluate vaccine effectiveness (VE) among immunocompromised adults, data from the VISION Network* on ",2021,11,5
34735422,"The Advisory Committee on Immunization Practices' Interim Recommendations for Additional Primary and Booster Doses of COVID-19 Vaccines - United States, 2021.","Three COVID-19 vaccines are currently approved under a Biologics License Application (BLA) or authorized under an Emergency Use Authorization (EUA) by the Food and Drug Administration (FDA) and recommended for primary vaccination by the Advisory Committee on Immunization Practices (ACIP) in the United States: the 2-dose mRNA-based Pfizer-BioNTech/Comirnaty and Moderna COVID-19 vaccines and the single-dose adenovirus vector-based Janssen (Johnson &amp; Johnson) COVID-19 vaccine (1,2) (Box 1). In ",2021,11,5
34717923,Lower Serologic Response to COVID-19 mRNA Vaccine in Patients With Inflammatory Bowel Diseases Treated With Anti-TNFa.,"Patients with inflammatory bowel diseases (IBD), specifically those treated with anti-tumor necrosis factor (TNF)a biologics, are at high risk for vaccine-preventable infections. Their ability to mount adequate vaccine responses is unclear. The aim of the study was to assess serologic responses to messenger RNA-Coronavirus Disease 2019 vaccine, and safety profile, in patients with IBD stratified according to therapy, compared with healthy controls (HCs). Prospective, controlled, multicenter Isra",2022,1,31
34696273,Predictors of Humoral Response to mRNA COVID19 Vaccines in Kidney Transplant Recipients: A Longitudinal Study-The COViNEPH Project.,"The efficacy of SARS-CoV-2 vaccination among kidney transplant recipients (KTR) is low. The main goal of this study was to analyze factors that may influence the humoral response to vaccination. We analyzed the titer magnitude of IgG antibodies directed against spike (S)-SARS-CoV-2 antigen after the second dose of the mRNA vaccine in 142 infection naïve KTR (83 men, i.e., 58.4%) with a median age (IQR) of 54 (41-63), and 36 respective controls without chronic kidney disease. mRNA-1273 or BNT162b",2021,10,29
34690347,[Humoral immunity against SARS-CoV-2 in workers of social health care centers of Castilla y León after vaccination with the BNT162b2 mRNA vaccine from Pfizer/Biontech.],"Workers and residents of care facilities for elder people/people with disabilities were particularly hit by the COVID-19 pandemic. Workers from these centres were included as a priority group for vaccination against SARS-CoV-2. The Family Ministry of Castilla y León realized a seroprevalence survey measuring the humoral immunity of its workers after the vaccination against SARS-CoV-2. In February and March 2021, IgM/IgG antibodies were measured in 7 social health care centers in a total of 1,085",2021,10,26
34685448,Robust Neutralizing Antibody Responses 6 Months Post Vaccination with BNT162b2: A Prospective Study in 308 Healthy Individuals.,"Elucidating long-term immunity following COVID-19 vaccination is essential for decision-making regarding booster shots. The aim of this study was to investigate the kinetics of neutralizing antibodies (Nabs) against SARS-CoV-2 up to six months after the second vaccination dose with the BNT162b2 mRNA vaccine. Nabs levels were measured on days 1 (before the first vaccine shot), 8, 22 (before the second shot), 36, 50, and 3 and 6 months after the second vaccination (NCT04743388). Three hundred and ",2021,10,26
34680595,The Slower Antibody Response in Myelofibrosis Patients after Two Doses of mRNA SARS-CoV-2 Vaccine Calls for a Third Dose.,"Immunization with mRNA SARS-CoV-2 vaccines has been highly recommended and prioritized in fragile subjects, including patients with myelofibrosis (MF). Available data on the vaccine immune response developed by MF patients and the impact of ruxolitinib treatment are still too fragmented to support an informed decision on a third dose for this category of subjects. Here, we show that 76% of MF patients develop spike-specific IgG after the second mRNA SARS-CoV-2 vaccine dose, but the response has ",2021,10,26
34671773,Heterologous SARS-CoV-2 Booster Vaccinations - Preliminary Report.,"While Coronavirus disease 2019 (Covid-19) vaccines are highly effective, breakthrough infections are occurring. Booster vaccinations have recently received emergency use authorization (EUA) for certain populations but are restricted to homologous mRNA vaccines. We evaluated homologous and heterologous booster vaccination in persons who had received an EUA Covid-19 vaccine regimen. In this phase 1/2 open-label clinical trial conducted at ten U.S. sites, adults who received one of three EUA Covid-",2021,11,10
34659597,NA,"A meta-analysis of the Chinese studies in April 2020, including 3600 patients with cancer and COVID-19, first reported an increase of the COVID-19 risk and the case-fatality in these patients. Then, North-American and European series confirmed the increased COVID-19 risk for patients with cancer, as the increased risk of severe COVID-19 and death, when compared with general population, adjusting for age. Patients with lung cancer have the highest risk of severe respiratory forms, and the highest",2021,10,22
34656379,Immunogenicity and reactogenicity of BNT162b2 booster in BBIBP-CorV-vaccinated individuals compared with homologous BNT162b2 vaccination: Results of a pilot prospective cohort study from Lebanon.,"Facing new COVID-19 waves, the effectiveness of BBIBP-CorV has been noted to be low in countries whose populations were already administered two doses of the vaccine. Heterologous vaccination using ChAdOx1-S/BNT162b2 elicited higher immunogenicity compared with homologous immunization. BBIBP-CorV/BNT162b2 combination is worth testing. In this pilot prospective cohort study conducted at Makassed General Hospital, Beirut, Lebanon, from February 17, 2021, to June 30, 2021, we tested the safety and ",2021,11,12
34642696,A Retrospective Analysis of COVID-19 mRNA Vaccine Breakthrough Infections - Risk Factors and Vaccine Effectiveness.,"Little is known about COVID vaccine breakthrough infections and their risk factors. To identify risk factors associated with COVID-19 breakthrough infections among vaccinated individuals and to reassess the effectiveness of COVID-19 vaccination against severe outcomes using real-world data. We conducted a series of observational retrospective analyses using the electronic health records (EHRs) of Columbia University Irving Medical Center/New York Presbyterian (CUIMC/NYP) up to September 21, 2021",2021,10,16
34636722,mRNA vaccine-induced T cells respond identically to SARS-CoV-2 variants of concern but differ in longevity and homing properties depending on prior infection status.,"While mRNA vaccines are proving highly efficacious against SARS-CoV-2, it is important to determine how booster doses and prior infection influence the immune defense they elicit, and whether they protect against variants. Focusing on the T cell response, we conducted a longitudinal study of infection-naïve and COVID-19 convalescent donors before vaccination and after their first and second vaccine doses, using a high-parameter CyTOF analysis to phenotype their SARS-CoV-2-specific T cells. Vacci",2021,10,28
34635537,Immunosuppression reduction when administering a booster dose of the BNT162b2 mRNA SARS-CoV-2 vaccine in kidney transplant recipients without adequate humoral response following two vaccine doses: protocol for a randomised controlled trial (BECAME study).,"Inadequate antibody response to mRNA SARS-CoV-2 vaccination has been described among kidney transplant recipients. Immunosuppression level and specifically, use of antimetabolite in the maintenance immunosuppressive regimen, are associated with inadequate response. In light of the severe consequences of COVID-19 in solid organ transplant recipients, we believe it is justified to examine new vaccination strategies in these patients. BECAME is a single-centre, open-label, investigator-initiated ra",2021,10,15
34634634,Serologic response to COVID-19 infection and/or vaccine in cancer patients on active treatment.,It was shown that immunocompromised patients have significantly reduced immunologic responses to COVID-19 vaccines. The immunogenicity of COVID-19 vaccine/infection in patients with solid tumors is reduced. We evaluated the immunologic response to COVID-19 and/or the BNT162b2 mRNA COVID-19 vaccine among cancer patients on active treatments and reviewed previous literature to identify subgroups that may require third vaccination. Anti-SARS-CoV-2 S1/S2 antibodies were measured in a cohort of 202 c,2021,12,23
34611073,COVID Arm After Moderna Booster in Healthcare Worker: A Case Report.,"SARS CoV-2 virus has infected more than 200 million people worldwide and more than 4.4 million in Indonesia. The vaccination program has become one of the solutions launched by many countries globally, including Indonesia, to reduce the transmission rate of COVID-19. Various vaccination platforms are produced, such as inactivated, viral vector, mRNA, and protein subunit. The vaccination booster program with mRNA platform (Moderna) was launched by the Indonesian government to give better protecti",2021,10,11
34603700,Antibody response to mRNA SARS-CoV-2 vaccines in haemodialysis patients.,"Some studies have shown an attenuated immune response in haemodialysis patients after vaccination. The present study examines the humoral response after mRNA vaccination against severe acute respiratory syndrome coronavirus 2 (SARS-CoV-2) in a large population of haemodialysis patients from different outpatient dialysis centres. We retrospectively assessed antibodies against SARS-CoV-2 spike protein and nucleocapsid protein (chemiluminescence immunoassays, Roche diagnostics) 3-6 weeks after the ",2021,10,5
34587552,State of the CAR-T: Risk of Infections with Chimeric Antigen Receptor T-Cell Therapy and Determinants of SARS-CoV-2 Vaccine Responses.,"Chimeric antigen receptor T cell (CAR-T) therapy has shown unprecedented response rates in patients with relapsed/refractory (R/R) hematologic malignancies. Although CAR-T therapy gives hope to heavily pretreated patients, the rapid commercialization and cumulative immunosuppression of this therapy predispose patients to infections for a prolonged period. CAR-T therapy poses distinctive short- and long-term toxicities and infection risks among patients who receive CAR T-cells after multiple prio",2021,12,20
34571415,Humoral immune response following SARS-CoV-2 mRNA vaccination concomitant to anti-CD20 therapy in multiple sclerosis.,The immunogenicity of COVID-19 vaccine among patients receiving anti-CD20 monoclonal antibody (Ab) treatment has not been fully investigated. Detectable levels of SARS-CoV-2 immunoglobulin G (IgG) are believed to have a predictive value for immune protection against COVID-19 and is currently a surrogate indicator for vaccine efficacy. To determine IgG Abs in anti-CD20 treated patients with multiple sclerosis (MS). IgG Abs against SARS-CoV-2 spike receptor-binding domain were measured with the SA,2021,12,16
34571262,Reactogenicity of a third BNT162b2 mRNA COVID-19 vaccine among immunocompromised individuals and seniors - A nationwide survey.,"Since July 13, 2021, a third SARS-CoV-2 vaccine BNT162b2 was approved in Israel to immunocompromised and seniors 60 years of age or older. We aimed to evaluate vaccine's reactogenicity. A retrospective cohort, using electronic surveys sent to booster vaccine recipients, during July 20-August 10, 2021. 17,820 participated in the survey, with a response rate of 30.2%. 3195 (17.9%) were immunocompromised. Fatigue, myalgia and fever were the most frequent systemic side effects reported (19.6%, 9.2% ",2021,11,30
34553353,[The impact of immunosuppression and chronic kidney disease on immunogenicity of COVID-19 vaccines].,HOW EFFECTIVE ARE THE APPROVED VACCINES IN KIDNEY DISEASES AND THOSE RECEIVING IMMUNOSUPPRESSION?:  Several observational studies indicated that immunosuppression is associated with a weakened or absent humoral response. Patients with chronic kidney diseases or undergoing maintenance dialysis without immunosuppression have a reduced humoral response to COVID-19 vaccines. I HAD COVID-19. SHOULD I GET VACCINATED?:  It is recommended to receive a booster after SARS-CoV-2 infection with a mRNA vacci,2021,9,30
34551091,Prior infection and age impacts antibody persistence after SARS-CoV-2 mRNA vaccine.,"Determining the duration of immunity to SARS-CoV-2 vaccines is critical for informing the timing of booster immunization. Many host factors could influence both the magnitude and persistence of the antibody response. Here, we showed that SARS-CoV-2 infection before vaccination and age affected the decay of antibody responses to the SARS-CoV-2 mRNA vaccine.",2021,10,22
34545374,Robust immune response to the BNT162b mRNA vaccine in an elderly population vaccinated 15 months after recovery from COVID-19.,"Knowledge about the impact of prior SARS-CoV-2 infection of the elderly on mRNA vaccination response is needed to appropriately address the need for booster vaccination in this vulnerable population. To address this, we investigated antibody and genomic immune responses in 16 elderly (avg. 81 yrs.) individuals that had received a single booster dose of BNT162b vaccine 15 months after recovering from COVID-19. Spike-specific IgG antibody levels increased in each of the study participants from an ",2021,9,24
34536028,SARS-CoV-2 specific antibody responses after third CoronaVac or BNT162b2 vaccine following two-dose CoronaVac vaccine regimen.,no abstract,2021,11,23
